0,1,2
9,"A sweet shop has one spherical ladoo of radius 5 cm with the same amount of material, how many ladoos of radius 2.5 cm can be made?",8
10,A wooden toy is in the form of a cone surmounted on a hemisphere. The diameter of the base of the cone is 6 cm and its height is 4 cm. Find the cost of painting the toy at the rate of Rs 5 per 1000 cm 2 .,Rs. 0.5189
11,"The volume of two spheres is in the ratio of 64:27. Find the difference of their surface areas, if the sum of their radii is 7.",88 units
12,What length of tarpaulin 3 mwide will be required to make conical tent of height 8 mand base radius 6m? Assume that the extra length of material that will be required for stitching margins and wastage in cutting is approximately 20 cm.,63m
13,An iron pillar has some part in the form of a right circular cylinder and remaining in the form of a right circular cone. The radius of the base of each of cone and cylinder is 8 cm. The cylindrical part is 240 cm high and the conical part in 36 cm high. Find the weight of the pillar if one cu. cm of iron weighs 7.8 grams.,379.68 kg
14,"A solid toy is in the form of a hemisphere surmounted by a right circular cone. The height of the cone is 4 cm and diameter of the base is 8 cm. Determine the volume of the toy. If the cube circumscribes the toy, then find the difference of the volumes of the cube and the toy. Also, find the total surface area of the toy.",311.04 cm3
15,"In a flood hit area, the volunteers of NSS erected a conical tent made of tarpaulin. The vertical height of the conical tent is 4m and the base diameter is 6m. If the width of tarpaulin is 4.5m then. Find the length of the tarpaulin used, assuming that 10% extra material is required for stitching margins and wastage in cutting. (Take  = 3.14)",11.51m
